{
    "$schema": "http://json-schema.org/draft-07/schema#",
    "title": "UnderWorldSettings",
    "description": "Configuration for running the UnderworldGodot project.",
    "type": "object",
    "properties": {

        "pathuw1": {
            "description": "Folder location of the Underworld 1 game files.",
            "type": "string",
            "default": "C:\\Games\\UW1"
        },

        "pathuw2": {
            "description": "Folder location of the Underworld 2 game files.",
            "type": "string",
            "default": "C:\\Games\\UW2"
        },

        "gametoload": {
            "description": "Which of the two games to load.",
            "type": "string",
            "enum": [ "UW1", "UW2" ],
            "default": "UW1"
        },

        "level": {
            "description": "The game level to load. (0-8 in UW1, 0-71 in UW2)",
            "type": "integer",
            "minimum": 0,
            "default": 0
        },

        "lightlevel": {
            "description": "Set the lighting level of the dungeon. Value is ignored.",
            "type": "integer",
            "minimum": 0,
            "maximum": 7,
            "default": 6
        },

        "levarkfolder": {
            "description": "Which save context to load.",
            "type": "string",
            "default": "DATA",
            "enum": [ "DATA", "SAVE1", "SAVE2", "SAVE3", "SAVE4" ]
        },

        "shader": {
            "description": "Default shader used. Value is ignored. (was previously used to allow for selection of different shaders during experimentation of palette effects)",
            "type": "string",
            "default": "UWSHADER"
        },

        "FOV": {
            "description": "Default field of view.",
            "type": "number",
            "default": 75.0
        },

        "showcolliders": {
            "description": "Enables displaying of collision meshes and colliders in game",
            "type": "boolean",
            "default": false
        },

        "shaderbandsize": {
            "description": "Controls how many light shades are calculated in between the vanilla shades.dat colour palette values to smooth light shading. (no of interpolated colours between the vanilla colours)",
            "type": "integer",
            "default": 8
        },

        "vr": {
            "description": "When true, start in OpenXR VR mode with head tracking and thumbstick movement.",
            "type": "boolean",
            "default": false
        },

        "vr_boot_mode": {
            "description": "VR boot path. explore = load straight into a level; full = intro cutscene, main menu, and character creation on a VR menu screen.",
            "type": "string",
            "enum": ["explore", "full"],
            "default": "full"
        },

        "datafolder": {
            "description": "Save slot used when vr_boot_mode is explore (DATA or SAVE1..SAVE4).",
            "type": "string",
            "default": "DATA",
            "enum": ["DATA", "SAVE1", "SAVE2", "SAVE3", "SAVE4"]
        },

        "vr_menu_screen_width": {
            "description": "Width of the front-menu TV quad in metres (vr_boot_mode full).",
            "type": "number",
            "default": 2.2
        },

        "vr_menu_screen_distance": {
            "description": "Distance from the headset to the menu TV quad in metres (vr_boot_mode full).",
            "type": "number",
            "default": 2.5
        },

        "vr_menu_screen_offset_y": {
            "description": "Vertical offset of the menu TV in metres; negative lowers the screen.",
            "type": "number",
            "default": -0.4
        },

        "vr_message_scroll_offset_x": {
            "description": "Head-locked message scroll offset in metres (X right, Y up).",
            "type": "number",
            "default": 0
        },
        "vr_message_scroll_offset_y": {
            "description": "Head-locked message scroll vertical offset in metres; negative lowers.",
            "type": "number",
            "default": 0
        },

        "vr_status_panels_always_visible": {
            "description": "When true, head overlays (scroll, flask, gem, eyes) stay visible instead of appearing on events and fading out.",
            "type": "boolean",
            "default": false
        },

        "vr_status_panels_display_seconds": {
            "description": "Seconds to show head overlays after activity before fading (when not always visible).",
            "type": "number",
            "default": 5
        },

        "vr_status_panels_fade_seconds": {
            "description": "Seconds for head overlay fade-out (when not always visible).",
            "type": "number",
            "default": 0.75
        },

        "vr_status_screen_width": {
            "description": "Virtual HUD screen width in metres for head-locked overlays (scroll, flask, gem, eyes).",
            "type": "number",
            "default": 2.2
        },

        "vr_status_screen_distance": {
            "description": "Distance in front of the headset for head-locked overlays.",
            "type": "number",
            "default": 2
        },

        "vr_status_panels_offset_y": {
            "description": "Vertical offset applied to all head overlays in metres; negative lowers the whole group.",
            "type": "number",
            "default": -0.4
        },

        "vr_health_flask_offset_x": {
            "description": "Head-locked health flask offset in metres (X right, Y up).",
            "type": "number",
            "default": 0
        },
        "vr_health_flask_offset_y": {
            "description": "Head-locked health flask vertical offset in metres; negative lowers.",
            "type": "number",
            "default": 0
        },
        "vr_health_flask_offset_z": {
            "description": "Head-locked health flask depth offset in metres; positive pushes farther from headset.",
            "type": "number",
            "default": 0
        },
        "vr_mana_flask_offset_x": {
            "description": "Head-locked mana flask offset in metres (X right, Y up).",
            "type": "number",
            "default": 0
        },
        "vr_mana_flask_offset_y": {
            "description": "Head-locked mana flask vertical offset in metres; negative lowers.",
            "type": "number",
            "default": 0
        },
        "vr_mana_flask_offset_z": {
            "description": "Head-locked mana flask depth offset in metres; positive pushes farther from headset.",
            "type": "number",
            "default": 0
        },
        "vr_compass_offset_x": {
            "description": "Head-locked compass offset in metres (X right, Y up).",
            "type": "number",
            "default": 0
        },
        "vr_compass_offset_y": {
            "description": "Head-locked compass vertical offset in metres; negative lowers.",
            "type": "number",
            "default": 0
        },
        "vr_compass_offset_z": {
            "description": "Head-locked compass depth offset in metres; positive pushes farther from headset.",
            "type": "number",
            "default": 0
        },
        "vr_inventory_offset_x": {
            "description": "Head-locked inventory/paperdoll offset in metres (X right, Y up).",
            "type": "number",
            "default": 0
        },
        "vr_inventory_offset_y": {
            "description": "Head-locked inventory/paperdoll vertical offset in metres; negative lowers.",
            "type": "number",
            "default": 0
        },
        "vr_inventory_offset_z": {
            "description": "Head-locked inventory/paperdoll depth offset in metres; positive pushes farther from headset.",
            "type": "number",
            "default": 0
        },
        "vr_weapon_anim_offset_x": {
            "description": "Head-locked weapon attack animation offset in metres (X right, Y up).",
            "type": "number",
            "default": 0
        },
        "vr_weapon_anim_offset_y": {
            "description": "Head-locked weapon attack animation vertical offset in metres; negative lowers.",
            "type": "number",
            "default": 0
        },
        "vr_weapon_anim_offset_z": {
            "description": "Head-locked weapon attack animation depth offset in metres; positive pushes farther from headset.",
            "type": "number",
            "default": 0
        },
        "vr_power_gem_offset_x": {
            "description": "Head-locked attack power gem offset in metres (X right, Y up).",
            "type": "number",
            "default": 0
        },
        "vr_power_gem_offset_y": {
            "description": "Head-locked attack power gem vertical offset in metres; negative lowers.",
            "type": "number",
            "default": 0
        },
        "vr_power_gem_offset_z": {
            "description": "Head-locked attack power gem depth offset in metres; positive pushes farther from headset.",
            "type": "number",
            "default": 0
        },
        "vr_eyes_offset_x": {
            "description": "Head-locked gargoyle/eyes offset in metres (X right, Y up).",
            "type": "number",
            "default": 0
        },
        "vr_eyes_offset_y": {
            "description": "Head-locked gargoyle/eyes vertical offset in metres; negative lowers.",
            "type": "number",
            "default": 0
        },
        "vr_eyes_offset_z": {
            "description": "Head-locked gargoyle/eyes depth offset in metres; positive pushes farther from headset.",
            "type": "number",
            "default": 0
        },

        "synth": {
            "description": "Music synthesizer engine. 'cm32l' and 'mt32' use mt32emu (require ROM files). 'soundfont' uses a SoundFont (SF2) file. 'opl' uses AdLib/OPL FM synthesis.",
            "type": "string",
            "enum": ["cm32l", "mt32", "soundfont", "opl"],
            "default": "soundfont"
        },

        "synthpath": {
            "description": "Path to ROM directory (for cm32l/mt32) or .sf2 file (for soundfont). Empty = use defaults.",
            "type": "string",
            "default": ""
        },

        "rompath": {
            "description": "DEPRECATED: use 'synthpath'. Legacy path to ROM directory — still read if synthpath is empty.",
            "type": "string",
            "default": ""
        }

    }
}